{
	"$id": "urn:repofixlab:schema:v1:harness-equivalence-report",
	"$schema": "https://json-schema.org/draft/2020-12/schema",
	"additionalProperties": false,
	"properties": {
		"adapter_sha256": {
			"pattern": "^[a-f0-9]{64}$",
			"type": "string"
		},
		"base_commit": {
			"pattern": "^[a-f0-9]{40}$",
			"type": "string"
		},
		"harness_revision": {
			"const": "726c5461e2ef52d83cf1ea2107870a8bb3328d57",
			"type": "string"
		},
		"instance_id": {
			"maxLength": 200,
			"minLength": 1,
			"type": "string"
		},
		"official_source_lock_sha256": {
			"pattern": "^[a-f0-9]{64}$",
			"type": "string"
		},
		"pristine_runtime_lock_sha256": {
			"pattern": "^[a-f0-9]{64}$",
			"type": "string"
		},
		"probes": {
			"items": {
				"additionalProperties": false,
				"properties": {
					"adapted_report_sha256": {
						"pattern": "^[a-f0-9]{64}$",
						"type": "string"
					},
					"equivalent": {
						"type": "boolean"
					},
					"expected_outcome": {
						"type": "boolean"
					},
					"mismatched_fields": {
						"items": {
							"maxLength": 100,
							"minLength": 1,
							"type": "string"
						},
						"type": "array",
						"uniqueItems": true
					},
					"pristine_report_sha256": {
						"pattern": "^[a-f0-9]{64}$",
						"type": "string"
					},
					"probe_kind": {
						"anyOf": [
							{
								"const": "base",
								"type": "string"
							},
							{
								"const": "no_op",
								"type": "string"
							},
							{
								"const": "malformed",
								"type": "string"
							},
							{
								"const": "gold",
								"type": "string"
							}
						]
					}
				},
				"required": [
					"probe_kind",
					"pristine_report_sha256",
					"adapted_report_sha256",
					"equivalent",
					"expected_outcome",
					"mismatched_fields"
				],
				"type": "object"
			},
			"maxItems": 4,
			"minItems": 4,
			"type": "array"
		},
		"report_sha256": {
			"pattern": "^[a-f0-9]{64}$",
			"type": "string"
		},
		"report_type": {
			"const": "harness_equivalence",
			"type": "string"
		},
		"schema_version": {
			"const": "v1",
			"type": "string"
		},
		"status": {
			"anyOf": [
				{
					"const": "pass",
					"type": "string"
				},
				{
					"const": "fail",
					"type": "string"
				}
			]
		}
	},
	"required": [
		"schema_version",
		"report_type",
		"instance_id",
		"base_commit",
		"harness_revision",
		"official_source_lock_sha256",
		"pristine_runtime_lock_sha256",
		"adapter_sha256",
		"status",
		"probes",
		"report_sha256"
	],
	"type": "object"
}
